tid,track,track_url,release_date,duration_ms,explicit,track_popularity,markets,albid,album,album_type,artid,artist,genres,artist_popularity,danceability,instrumentalness,speechiness,valence,loudness,added_at,lyrics
6cyXHTix4NQ069gKJEYv41,Tshwala Bam (feat. S.N.E) - Remix,https://open.spotify.com/track/6cyXHTix4NQ069gKJEYv41,2024-05-13,203571,False,71,184,1ZyNY4zHrl8MMzZ5li2Pm2,Tshwala Bam (feat. S.N.E) [Remix],single,5eYSqn4LCXLgIFYR4qOZ1k,TitoM,['amapiano'],62,0.813,0.00667,0.0426,0.517,-12.066,2024-06-07,"['[Burna Boy]', '(Uza lebaby)', '(Sho, fetsa bjang reso thome chommie?)', 'Ma jo jo', 'Ma jo', 'Ma jo jo', 'Ma jo jo', 'Ma jo', 'Ma jo jo', '[Burna Boy, S.N.E]', 'Since 1947, the matter never settle', 'You be pot, I be kettle', ""My sability lo ya won l'enu"", 'Better recognise', 'Greatest of all time', 'No other name them go call mine', ""As I dey shine teeth l'm not nice"", 'Monday ita la wa (Lele)', 'Tuesday ita la wa', 'Wednesday ita la wa (Yeh)', 'As long as Naija la wa (Yeh yeh yeh)', 'Them they call me the Godfather (Dlala ngami)', 'Move like an Italian (Dlala eh)', ""Ti ara ba n'ta yin (Dlala yoh, wetshwala bami)"", 'Have you ever seen a nigga like moi (Mali yoh)', 'Each and every lady wanna gimme me mwah', 'We dey smoke weed, we no dey smoke cigar (Dlala ngami)', 'Na we ite Achorom nwa', 'I no do pass king Solomon', 'I get high adrenalin (Mali yeh)', 'If you no like me iwo lo mo', 'My advice is run along (Dlala ngami)', ""Cause my guys ti won bo l'ona (Dlala ngami)"", 'Make the sky start falling down', ""Ti ori ba n'ta yin (Dlala eh)"", ""I'm still your daddy (Tshwala bami)"", '[S.N.E]', 'Ngixolele tshwala', 'Ngaqeda imali yami', ""Wang'sinda umthwalo wami"", ""Wal'thetha icala"", 'Wetshwala udlala ngami', 'Endlini bakhala ngami', 'Wadlala ngami, wetshwala bami', '[S.N.E]', 'Ngalithetha icala lami', ""Kufik'umongameli bakhala ngam"", 'Manje nezitha sezizwana nami (Eh)', ""Ngathi bebangakholwa ngabanik'utshwala bam"", 'Tito bangazodlala laba (Yoh Yoh Yoh)', 'Yuppe ayi utshwala bami', ""Jikijiki bangthwalel' umthwalo wami"", 'Eish weh tshwala bami', ""Ayi mongameli uyis'dakwa (Is'dakwa)"", 'Vele ngoba ngena macala (Macala)', 'Amacase nama court Savanna', ""S'vele sikhwele kulolodaba"", 'Shibidim shibidam shibidibishamshe', ""Ivel'igubude siphuz intwengapheli, pheli"", 'Uzobadelel umongameli (Iyoh, Yoh)', '[Burna Boy, S.N.E]', 'Monday ita la wa (Lele)', 'Tuesday ita la wa', 'Wednesday ita la wa (Yeh)', 'As long as Naija la wa (Yeh yeh yeh)', 'Them they call me the Godfather (Dlala ngami)', 'Move like an Italian (Dlala eh)', ""Ti ara ba n'ta yin (Dlala yoh, wetshwala bami)"", '[S.N.E]', 'Ngixolele tshwala (Lele)', 'Ngaqeda imali yami (Mali yeah)', ""Wang'sinda umthwalo wami"", ""Wal'thetha icala"", 'Wetshwala udlala ngami (Dlala ngam)', 'Endlini bakhala ngami (Khala)', 'Wadlala ngami (Dlala yoh)', 'Wetshwala bami (Tshwala bami)', '[S.N.E, Burna Boy]', 'Tshwala bami (Ma jo jo)', 'Tshwala bami yeah (Ma jo)', 'Tshwala bami (Ma jo jo)', 'Tshwala bami yeah (Ma jo)', 'Tshwala bami (Ma jo jo)', 'Tshwala bami yeah (Ma jo)', 'Tshwala bami (Ma jo jo)', 'Tshwala bami yeah (Ma jo, Ma jo jo)']"
51aYPHVdOL9sIPOZj9dlXK,Be Honest,https://open.spotify.com/track/51aYPHVdOL9sIPOZj9dlXK,2019-11-20,207030,False,46,3,6rr0eXdvaplCmUWqT1t1Dp,Lost & Found,album,1CoZyIx7UvdxT5c8UkMzHd,Jorja Smith,"['r&b', 'uk contemporary r&b']",70,0.767,0.0,0.106,0.635,-5.891,2024-06-07,"[""Every day, tell me when you're lonely‚ yeah"", 'You see‚ you think\u2005you\u2005know me', ""But you\u2005don't even know nothing about me‚\u2005yeah"", 'You see my thick thighs', 'Lost when you look into my brown eyes', 'See, my little waist can make you switch sides', 'You never know the devil in the disguise', ""So why don't you stand up, baby‚ and"", 'Tell me, tell me, tell me do you want me on top?', ""So let me show you‚ show you, show you, I don't need to back it don't wanna hold ya, mold ya, stole ya"", 'Split you in half with my heart', 'I just wanna love in you, trust in you, honour you', 'Please do the same on your part', 'Be honest (Be honest)', 'You want this (You want this)', 'But I can be heartless', 'It got this on my conscience', 'Be honest (Be honest)', 'You want this (You want this)', 'But I can be heartless', 'It got this on my conscience', ""Take time, you no say I'm wrong whenever I see bad vibes"", 'Before you come my way, make sure you think twice', 'Look into my eyes but I can never see us', 'I can product you, but you know I could never lie, yeah', 'Come through', ""I can show you somethin' you can run to"", ""When I finish, you'll be feelin' brand new"", 'Wanna be somebody you can run through', ""I'm lookin' for that, I'm alive"", 'One time, no care, big vibes, slow back', 'Catch feels, get high', 'If you make your bed, then you can lie', ""Just please don't waste my time"", 'Be honest (Be honest)', 'You want this (You want this)', 'But I can be heartless', 'It got this on my conscience', 'Be honest (Be honest)', 'You want this (You want this)', 'But I can be heartless', 'It got this on my conscience', 'People, they talk, they majesty', ""Love the way your body twistin'"", 'Mek me lose control in the this ting, oh', ""And it's all because I'm thinkin' of us"", ""Don't go throw me under di bus"", ""Under a spell, I'm under your love"", ""I don't know why nobody want me"", 'Listen, my baby could be, do me bad', 'But your love inside my hoody bag', 'If I do you back', 'I better make you know, do me back', 'Gimme one time, one try', 'Be mine, this time', 'Take time, same time', 'But we never waste time', ""Girl, I never lie, you already know that I'll be honest"", 'Be honest (Be honest, ooh yeah)', 'You want this (You want this)', 'But I can be heartless', 'It got this on my conscience (Ooh yeah)', 'Be honest (Be honest)', 'You want this (You want this)', 'But I can be heartless', 'It got this on my conscience', 'Be honest (Be honest)', 'You want this (You want this)', 'But I can be heartless', 'It got this on my conscience', 'Be honest', 'You want this (You want this)', 'But I can be heartless', 'It got this on my conscience']"
6fYefaw0KturTfuRNTKFbX,Do You Mind?,https://open.spotify.com/track/6fYefaw0KturTfuRNTKFbX,2023-07-28,147174,False,47,183,2ZWPLY75DaydQvoeVMHfh3,Tequila Ever After,album,2IK173RXLiCSQ8fhDlAb3s,Adekunle Gold,"['afrobeats', 'afropop', 'alte', 'azontobeats', 'nigerian hip hop', 'nigerian pop']",61,0.806,1.11e-06,0.457,0.658,-8.521,2024-06-07,"['Do you mind?', 'Do you mind?', 'Take the backseat of my foreign', 'Do you mind?', 'Do you like it', 'On the bonnet of McLaren?', 'Give me sign', 'No surprises', 'I fire shots, no warning', 'Do you mind?', 'Do you mind?', '(Girl do you mind)', 'Seventeen, eighteen, nineteen, baby', 'Rora baby ma fi jo pami o', 'You go make me do something crazy', 'We go break the rules for this party o', 'Girl, I want to hear your body talk', 'We no wasting no time, tick-tock', 'Now, on your mark, get set, get ready o', 'Rotate ya bum bum', 'I know you’re here for a show oo', 'You wanna ride da poco loco', 'Inside inside my sokototo', 'Inside inside my sokototo', 'Make you dancе my konto konto', 'You wanna ride da poco loco', 'Inside inside my sokototo', 'Insidе inside my sokototo', 'Do you mind?', 'Do you mind?', 'Take you on a one way trip to paradise', '(Paradise)', 'I just wanna feel some passion harmonize', '(Harmonize)', 'Love and affection make me come alive', 'Make me come alive', 'Seventeen, eighteen, nineteen, baby', 'Rora baby ma fi jo pami o', 'You go make me do something crazy', 'We go raise the roof for this party o', 'Girl, I want to hear your body talk', 'We no wasting no time, tick-tock', 'Now, on your mark, get set, get ready o', 'Rotate ya bum bum', 'I know you’re here for a show', 'You wanna ride da poco loco', 'Inside inside my sokototo', 'Inside inside my sokototo', 'Make you dance my konto konto', 'You wanna ride da poco loco', 'Inside inside my sokototo', 'Inside inside my sokototo']"
5tM3Fo4qBqDAwWJ9ZY5AtX,YAWA,https://open.spotify.com/track/5tM3Fo4qBqDAwWJ9ZY5AtX,2023-06-22,180000,True,62,185,3x4uU6LegVMe04Dn5fLiLw,YAWA,single,75VKfyoBlkmrJFDqo1o2VY,Fireboy DML,"['afrobeats', 'nigerian pop']",69,0.847,0.000787,0.0391,0.636,-6.452,2024-06-07,"['Man on a mission', 'I see no competition', 'And I mind my business', 'God is my witness', ""They don't see my vision"", 'Omo ologo jẹjẹ mi mo n lọ o', 'One in a million', 'Wetin dem talk say I do now?', 'Yawa dey o', 'Yawa dey o', 'Yawa dey o', ""Oj'ojumọ lọ n s'ọrọ mi"", 'Jẹ kan maa nue nue nue', 'Yawa dey o', 'Yawa dey o', 'Yawa dey o', ""Oj'ojumọ lọ n s'ọrọ mi"", 'Jẹ kan maa nue nue nue', 'Ki lo tun de, ki lo tun de', 'Ki lẹ tun fye, ki ni mo ṣe?', 'I dey jẹjẹly go my way', 'But dem say, dem say', 'Ki lo wa de, ki lo wa de', 'Ki lẹ tun fẹ, ki ni mo ṣe?', 'I dey jẹjẹly go my way', 'Anything, anything I say', 'Dem say', 'Yawa dey o', 'Yawa dey o', 'Yawa dey o', ""Oj'ojumọ lọ n s'ọrọ mi"", 'Jẹ kan maa nue nue nue', 'Yawa dey o', 'Yawa dey o', 'Yawa dey o', ""Oj'ojumọ lọ n s'ọrọ mi"", 'Jẹ kan maa nue nue nue', 'Jẹ kan maa sọ lọ', 'I no fit dull, I no kill person o', ""Mi o n ṣ'ọmọ isọlọ"", 'I be sure boy', 'I no thief person own', 'Enter my convoy', 'We dey burn up', 'I don dey smoke igbo', 'One bang tun ti roll up', 'Mo ti jogor', 'I no see person o', ""Don't give a fuck anything you talk"", ""I did more than enough, I've been on the block"", ""I've been giving it all on the dance floor"", ""24/7 'round the clock and I swear to God (ouu!)"", ""Awon t'emi wan gbọ mi gan"", '365 days we dey burn it up', 'Life on the road always on the go', 'We dey cho! dey rigimarol', 'Ọmọ', 'Ki lo tun de, ki lo tun de', 'Ki lẹ tun fye, ki ni mo ṣe?', 'I dey jẹjẹly go my way', 'But dem say, dem say', 'Ki lo wa de, ki lo wa de', 'Ki lẹ tun fẹ, ki ni mo ṣe?', 'I dey jẹjẹly go my way', 'Anything, anything I say', 'Dem say', 'Yawa dey o', 'Yawa dey o', 'Yawa dey o', ""Oj'ojumọ lọ n s'ọrọ mi"", 'Jẹ kan maa nue nue nue', 'Yawa dey o', 'Yawa dey o', 'Yawa dey o', ""Oj'ojumọ lọ n s'ọrọ mi"", 'Jẹ kan maa nue nue nue']"
2tsuHoDRjMTPkibpOkRuq4,Sensima,https://open.spotify.com/track/2tsuHoDRjMTPkibpOkRuq4,2018-10-17,187794,False,54,176,4zpIOgKbJU2MdA0PK6hoeI,Sensima,single,72Z2AhMKpxZjLNnPMyinUE,Skiibii,"['afrobeats', 'nigerian pop']",48,0.874,0.0,0.177,0.884,-3.973,2024-06-07,"['Owole, owo net', 'Kpakam, body too correct', 'Oh no, no, no, Erima no forget', 'Moniko gbefun, o collect', 'Owole, owo net', 'Kpakam, body too correct', 'She say she love me, Eyan loveth', 'Sensima', 'Why you dey fall hand Benzema', 'Why you wan dey dull am? Sensima', 'This kind dance you dey dance', ""I'm doing the singing"", ""You' doing the dancing (Sensima)"", 'Ah woyiwo', 'Why you wan dey do me long thing?', 'Shey o gbeno sori o, why you dey do me strong thing? (Ya ya)', 'Ah woyiwo', 'Why you wan dey do me long thing?', 'Shey o gbeno sori o, why you dey do me strong thing? (Ya ya ya ya)', 'Gbefun eh o collect', 'Owole, owo net', 'Kpakam, body too correct', 'Oh no, no, no, Erima no forget', 'Moniko gbefun, o collect', 'Owole, owo net', 'Kpakam, body too correct', 'She say she love me, Eyan loveth', 'Sensima', 'Why you dey fall hand…']"
26b3oVLrRUaaybJulow9kz,People,https://open.spotify.com/track/26b3oVLrRUaaybJulow9kz,2022-12-06,184791,False,75,185,5Hmh6N8oisrcuZKa8EY5dn,People,single,7kjSuFGKhLm8b5qXoMhRkJ,Libianca,['afrobeats'],64,0.573,1.31e-05,0.0678,0.693,-7.621,2024-06-07,"['[Libianca]', 'Oh-oh-oh-oh', 'Mhmm, mhmm', ""From Bamenda, it's Libianca"", 'Oh-oh (A-yo, Mage, you made a bang)', '[Libianca]', ""I've been drinking more alcohol for the past five days"", 'Did you check on me?', 'Now, did you look for me?', ""I walked in the room, eyes are red and I don't smoke banga"", 'Did you check on me? (Did you check on me?)', 'Now, did you notice me?', '[Libianca]', 'Nobody wey know the paranoia oh', ""'Cause I put a smile on my face"", 'A façade you can never face (Ooh)', ""And if you don't know me well, well, oh"", ""You won't see how buried I am inside my grave"", 'Inside my grave', '[Libianca]', ""'Cause you see people, people, people, people"", ""Don't really know you"", ""They don't really know you"", ""'Cause you see people, people, people"", ""They don't really know you"", ""They don't really know "", '[Libianca]', ""I've been drinking more alcohol for the past five days"", 'Did you check on me?', 'Now, did you look for me?', ""I walked in the room, eyes are red and I don't smoke banga"", 'Did you check on me? (Did you check on me?)', 'Now, did you notice me?', '[Libianca]', 'Oh, holy father', 'Oh, holy father, I dey try fo hold my head', 'I say make you no leave me diko', 'Oh, holy father (Yeah-yeah)', 'Oh, make you try fo understand', 'Yahoo girl no dey for here', '[Libianca & MAGETHEPRODUCER]', ""'Cause you see people (Bang), people, people, people"", ""Don't really know you (They don't really know you)"", ""They don't really know you"", ""'Cause you see people (Bang), people, people"", ""They don't really know you (Mmm)"", ""They don't really know "", '[Libianca]', ""I've been drinking more alcohol for the past five days"", 'Did you check on me?', 'Now, did you look for me?', ""I walked in the room, eyes are red and I don't smoke banga"", 'Did you check on me? (Did you check on me?)', 'Now, did you notice me?', ""I've been drinking more alcohol for the past five days"", 'Did you check on me?', 'Now, did you look for me?', ""I walked in the room, eyes are red and I don't smoke banga"", 'Did you check on me? (Did you check on me?)', 'Now, did you notice me?', '[Libianca]', ""I've been drinking more alcohol for the past five days"", 'Did you check on me?']"
64f7mZuEkeNeKOuzSjrIGm,Big Thug Boys,https://open.spotify.com/track/64f7mZuEkeNeKOuzSjrIGm,2021-06-04,171998,True,45,185,79PtaeN11NuACxUaeipBom,Big Thug Boys,single,5p1CMGIDFgalZneW5P1EwX,Babyboy AV,"['afrobeats', 'nigerian pop']",51,0.866,0.00428,0.173,0.813,-4.197,2024-06-07,
3GLF4uV3uS1ImSEPyhLZLp,Yebo,https://open.spotify.com/track/3GLF4uV3uS1ImSEPyhLZLp,2024-06-07,263683,False,44,185,6muXgX86KpOiFDo0P07e7d,Turn Off The Lights,album,25j9xL1MTyuycuB2xy2Q9g,TxC,['amapiano'],45,0.836,0.000176,0.0849,0.37,-18.934,2024-06-07,[]
2woGTVY8Vx46aYuXfMmwwE,Traboski,https://open.spotify.com/track/2woGTVY8Vx46aYuXfMmwwE,2022-11-24,155860,False,49,185,7A0qUYFzVQZGI6IcFebIiN,Traboski,single,3zaDigUwjHvjOkSn0NDf9x,Bnxn,"['afrobeats', 'nigerian pop']",68,0.798,8.31e-06,0.0471,0.901,-8.985,2024-06-07,
3k3NWokhRRkEPhCzPmV8TW,Ojitos Lindos,https://open.spotify.com/track/3k3NWokhRRkEPhCzPmV8TW,2022-05-06,258298,False,78,185,3RQQmkQEvNCY4prGKE6oc5,Un Verano Sin Ti,album,4q3ewBCX7sLwd24euuV69X,Bad Bunny,"['reggaeton', 'trap latino', 'urbano latino']",93,0.647,1.34e-06,0.0413,0.268,-5.745,2024-06-07,"[""Y pasan los día', los mese’ pensando en to' lo' (En to’ lo', en to' lo')"", 'Ha llegado el tiempo para usar la razón', ""Antes que sea tarde y sin querer me parta en do' (Parta en do')"", 'Antes de que salga el sol, pisa el acelerador', ""Aunque vaya sin freno' y pierda el control"", ""Nada más'seremos do’, tú y yo acariciándono’"", ""En medio del tiempo, sin decir adió'"", ""Y solo mírame con esos ojito’ lindo'"", ""Que con eso' yo también he vuеlto a nacer"", 'Hace tiempo (Tiеmpo) que no agarro a nadie de la mano (Mano)', 'Hace tiempo (Tiempo) que no envío ""buenos días, te amo"" (Te amo)', ""Pero, tú me tienes enreda'o, me envolví"", 'Iba por mi camino y me perdí (Ey, ey)', 'Mi mirada cambió cuando tus ojos vi (Tus ojos vi)', 'Bye-bye a los culo’, ni me despedí', ""Yo no te busqué, no, chocamo' en el trayecto"", 'Con tu alma en la calle conecto (-necto)', 'Tranquila, no tiene que ser perfecto, no', 'Aquí no existe el pecado y equivocarse es bonito', ""Los errore' son placere', igual que to' tus besito'"", ""Y solo mírame con esos ojito' lindo'"", ""Que con eso' yo también he vuelto a nacer"", ""Y solo mírame con esos ojito' lindo'"", ""Que con eso' yo también he vuelto a nacer"", 'Tú y yo, tú y yo, tú y yo', 'Tú y yo, tú y yo', 'Tú y yo, tú y yo, tú y yo', 'Tú y yo, tú y yo', 'Tú y yo, tú y yo', 'Tú y yo, tú y yo', 'Yo no me dejo llevar de nadie', 'Yo solo me dejo llevar de tu sonrisa', 'Y del lunar cerquita de tu boca', ""Si yo 'toy loco, tú estás loquita"", 'Pero, baby, como tú no hay otra, no', ""Quiero regalarte girasole'"", ""Ir pa' la playa y buscarte caracole'"", ""Cuando estoy contigo, yo no miro el Role'"", ""Vamo' a bailar doscientas cancione'"", ""Nadie me pone como tú me pone' (Pone')"", 'Mm-mmm, mm-mmm-mmm-mmm', 'Mm-mmm, mm-mmm-mmm-mmm', ""Yo le hablo a Dio' y tú ere' su respuesta"", ""Aprendí que los momento' lindo' nunca cuestan"", 'Como cuando me regalas tu mirada', 'Y el sol su puesta (Ey), y el sol su puesta (Ey)', 'Cuando estoy encima de ti, de ti', ""Mami, yo me olvido de to', de to'"", 'No hace falta nadie aquí', 'Solamente tú y yo', 'Antes de que salga el sol, pisa el acelerador', ""Aunque vaya sin freno' y pierda el control"", ""Nada más seremos do', tú y yo acariciándono'"", ""En medio del tiempo, sin decir adió'"", ""Y solo mírame con esos ojito' lindo'"", ""Que con eso' yo también he vuelto a nacer"", ""Y solo mírame con esos ojito' lindo'"", ""Que con eso' yo también he vuelto a nacer""]"
1akSDgOrWqGhHy4ZWIM4nd,Feels,https://open.spotify.com/track/1akSDgOrWqGhHy4ZWIM4nd,2024-06-05,183716,False,36,185,7c9ijsXzppdoXA8OEdDA2k,Feels,single,0iqznAW9pzZ7KOjx8aCMWo,Tay Iwar,"['afrobeats', 'alte', 'nigerian pop']",49,0.765,0.00264,0.0548,0.707,-8.335,2024-06-07,
6UTXf9k0H3JDus2ZZDwGpC,Favourite Girl,https://open.spotify.com/track/6UTXf9k0H3JDus2ZZDwGpC,2024-05-02,156000,True,65,185,1sbGuc7mOIgMFQoNFJHaRh,Favourite Girl,single,4QSTyDpxsKmv3UfavVUImR,Darkoo,"['afrobeats', 'afroswing', 'london rap', 'nigerian pop', 'uk hip hop']",58,0.733,0.0,0.16,0.875,-4.663,2024-06-07,"[""There's just me and this girl"", 'Hand on my heart, if I be honest, girl', 'She lose control, when she feel horny', 'The patrona got me down', 'You like this high life ting my love', 'I love being your love', ""I'm tryna show you off, you off"", 'Comforter', 'She really that A-list girl', 'She really my favourite girl', ""I'm loving the way you twirl, you twirl"", 'In the Maybach', 'She really that A-list girl', 'She really my favourite girl', ""I'm loving the way you twirl, you twirl"", ""Pressure's burning on me"", 'Would you come do it slowly?', 'Girl dutty whine. Would you bend it for me?', 'Take a picture in your short sleeve', 'I got a feeling one of these days', ""You'll be the reason I stay"", 'Way you whine, girl. You make me insane', 'Me get sneeze una', 'Never met a bad man like dis una', 'And I make a man C like breeze una', ""She say I'm fine like star boy wiz una"", 'I got a feeling one of these days', ""You'll be the reason I stay"", 'Way you whine, girl. You make me insane', 'Baby boy, I love the way you treat me', ""He shower me because I'm spoilt and I'm meaty"", 'Tell me you like what you see', 'Come and please me', 'One of a kind. Yeah. My vibe so intriguing', 'I like him rough around the edges. Real rude boy', 'Real star boy', 'Make me your star girl', ""Love to hear it when you tell me that it's my world"", 'You know that passion and desire make my toes curl', 'I know you wanna dive deep in my ocean', 'You wanna see these hips in motion', 'Baby, show me you know how to control it', 'And you can have it when you want it', 'Comforter', 'She really that A-list girl', 'She really my favourite girl', ""I'm loving the way you twirl, you twirl"", 'In the Maybach', 'She really that A-list girl', 'She really my favourite girl', ""I'm loving the way you twirl, you twirl"", ""Pressure's burning on me"", 'Would you come do it slowly?', 'Girl dutty whine. Would you bend it for me?', 'Take a picture in your short sleeve', 'I got a feeling one of these days', ""You'll be the reason I stay"", 'Way you whine, girl. You make me insane']"
1hEXElwyPez2z7m5dZ56Mc,Fall,https://open.spotify.com/track/1hEXElwyPez2z7m5dZ56Mc,2019-11-22,240000,False,52,185,0s3BbZlcqsUdAD8wIYdO5n,A Good Time,album,0Y3agQaa6g2r0YmHPOO9rh,Davido,"['afrobeats', 'afropop', 'azontobeats', 'ghanaian hip hop', 'nigerian pop']",70,0.928,0.0,0.0568,0.794,-3.542,2024-06-07,"['Iyeh-eeh!', 'Money fall on you', 'Banana fall on you', 'Prada fall on you oh', ""'Cause, I'm in love with you oh, eeh"", 'Money fall on you', 'Banana fall on you', 'Paparazzi follow you oh', ""'Cause, I'm in love with you oh, yeeh!"", 'Are you done talking?', 'Tell me baby, are you done talking? yeeah', 'Are you done talking?', 'Tell me baby, are you done talking? yeeah', 'Are you done talking?', 'Tell me baby, are you done talking? yeeah', 'Are you done talking?', 'Tell me baby, are you done talking? yeh-eh-eh', ""I don't wanna be a player no-more, ah-ahaan, yeah"", ""I don't wanna be a player no more"", ""'Cause, my guys call me Cristiano"", 'Mr. Ronaldo...', 'Omo Nintendo', 'Plus, my guys call me Cristiano', 'Mr. Ronaldo...', 'Omo Nintendo-oo, eeh', 'Money fall on you', 'Banana fall on you', 'Prada fall on you oh', ""'Cause, I'm in love with you oh, eeh"", 'Money fall on you', 'Banana fall on you', 'Paparazzi follow you oh', ""'Cause, I'm in love with you oh, eeh"", 'Yeeh! If I offend you-ou', 'If I offend you-ou-ou, biko', 'Sorry oh, baby take heart oh', 'Sorry oh, baby take heart oh', ""I'm in love with you-ooh"", ""I'm in love with you-ou, oh"", 'Baby, nothing go fit to change am oh', 'Nothing go fit to change am oh, eh-eeeh', 'If I talk, them go say I dey talk, yeeh!', 'Tell me why them dey use Panadol for our headache eeh', 'Yeeh! How I go chop if my baby no chop?', 'Nne, they want to spoil our market eeeeeeh', ""I don't wanna be a player no-more, yeah"", ""I don't wanna be a player no more"", ""'Cause, my guys call me Cristiano"", 'Mr. Ronaldo .. Omo Nintendo-oo, eeh', 'Plus, my guys call me Cristiano', 'Mr. Ronaldo .. Omo Nintendo-oo, eeh', 'Money fall on you', 'Banana fall on you', 'Prada fall on you oh', ""'Cause, I'm in love with you oh, eeh"", 'Money fall on you', 'Banana fall on you', 'Paparazzi follow you oh', ""'Cause, I'm in love with you oh, eeh"", 'If I offend you-ou', 'If I offend you-ou-ou, biko', 'Sorry oh, baby take heart oh', 'Sorry oh, baby take heart oh', ""I'm in love with you-ooh"", ""I'm in love with you-ou, oh"", 'Baby, nothing go fit to change am oh', 'Nothing go fit to change am oh', 'Money fall on you', 'Banana fall on you', 'Prada fall on you oh', ""'Cause, I'm in love with you oh, eeh"", 'Money fall on you', 'Banana fall on you', 'Paparazzi follow you oh', ""'Cause, I'm in love with you oh, eeh-eh"", 'Kiddo-Kiddo! Kiddominaaa-aant!', 'Your girlfriend favourite song']"
05A6mr7C2bP7uPrEQrj9qk,"Tested, Approved & Trusted",https://open.spotify.com/track/05A6mr7C2bP7uPrEQrj9qk,2023-08-23,220394,False,61,135,51r39Gm18d7yIS3PC1QD8B,I Told Them...,album,3wcj11K77LjEY1PkEazffa,Burna Boy,"['afrobeats', 'azontobeats', 'dancehall', 'nigerian hip hop', 'nigerian pop']",77,0.821,2.71e-06,0.0941,0.647,-9.976,2024-06-07,"[""Baby, don't whine pon your seat"", 'Come give me that', 'Jump upon my body like animal', 'Dance make you feel like carnival', 'I go lock you down like criminal', ""One touch feelin' like one million"", 'People just dey watch you like a cinema', 'Whine pon di ting like carnival', 'Make sure you do nobody else like this', ""Baby, don't whine pon your seat"", 'Come give me that', 'Jump upon my body like animal', 'Dance make you feel like carnival', 'I go lock you down like criminal', ""One touch feelin' like one million"", 'People just dey watch you like a cinema', 'Whine pon di ting like carnival', 'Make sure you do nobody else like this', 'Ehen, we, hey', 'Tested, approved and trusted, trusted', 'Tested, approved and trusted, oh, please, believe', 'Tested, approved and trusted, trusted', 'Tested, approved and trusted, trusted', 'Inna di middle of all of these beautiful girls in the world', 'Wey dey dance on the floor', 'As dem don manya na to bend am', 'Me I just want sempe for the centre', 'Baby, gyrate your waistline, roll it now', 'No slow down, just bring am, to me now', 'Submit am, no teasing', ""Baby, don't whine pon your seat"", 'Come give me that', 'Jump upon my body like animal', 'Dance make you feel like carnival', 'I go lock you down like criminal', ""One touch feelin' like one million"", 'People just dey watch you like a cinema', 'Whine pon di ting like carnival', 'Make sure you do nobody else like this', 'Wan jasi', 'The way you do fantastic', 'Have to put on glasses', 'Make you no blind me with this your body', ""When I see you whinin' fi di wall"", 'Make me want to turn into the wall', 'Make me feel like we no dey for real life', 'Everything nice where you are', ""Baby, don't whine pon your seat"", 'Come give me that', 'Jump upon my body like animal', 'Dance make you feel like carnival', 'I go lock you down like criminal', ""One touch feelin' like one million"", 'People just dey watch you like cinema', 'Whine pon di ting like carnival', 'Make sure you do nobody else like this', 'Ehen, we, hey', 'Tested, approved and trusted, trusted', 'Tested, approved and trusted, oh, please, believe', 'Tested, approved and trusted, trusted', 'Tested, approved and trusted, trusted']"
4yaPPFIafaVaMRHZ5IHkbA,No Wahala - Remix,https://open.spotify.com/track/4yaPPFIafaVaMRHZ5IHkbA,2022-03-02,178413,False,55,185,1CuCITWTEr6lE2q3MraOSG,No Wahala (Remix),single,6dlzQ6fiPna40trq1Ek6cb,1da Banton,"['afrobeats', 'nigerian pop']",56,0.597,1.59e-05,0.168,0.73,-5.517,2024-06-07,
4wG7xubJwUdjvdVJvAV1d9,Big Energy,https://open.spotify.com/track/4wG7xubJwUdjvdVJvAV1d9,2022-06-10,185000,False,37,185,4ooUYNH9ZD44v6wpIv5huk,Big Energy,single,379IT6Szv0zgnw4xrdu4mu,LADIPOE,"['afrobeats', 'nigerian pop']",51,0.774,6.42e-06,0.203,0.591,-9.212,2024-06-07,
